{"$schema":"http://json-schema.org/draft-07/schema#","$id":"https://full-video-pipeline/animations/radial-pulse-rings.schema.json","title":"RadialPulseRings instance","type":"object","additionalProperties":false,"required":["extras"],"properties":{"$schema":{"type":"string"},"instanceId":{"type":"string"},"theme":{"$ref":"https://full-video-pipeline/schemas/animations.schema.json#/definitions/theme"},"global":{"$ref":"https://full-video-pipeline/schemas/animations.schema.json#/definitions/global"},"elements":{"type":"array","items":{"type":"object","additionalProperties":true,"required":["id"],"properties":{"id":{"type":"string","enum":["node-glyph","node-label"]},"text":{"type":["string","null"]},"delay":{"type":["number","null"],"minimum":0,"maximum":60000},"duration":{"type":["number","null"],"minimum":1,"maximum":60000},"easing":{"$ref":"https://full-video-pipeline/schemas/animations.schema.json#/definitions/easingName"},"position":{"$ref":"https://full-video-pipeline/schemas/animations.schema.json#/definitions/element/properties/position"},"size":{"type":"object","additionalProperties":false,"properties":{"fontSize":{"type":["number","null"],"minimum":4,"maximum":1000},"scale":{"type":["number","null"],"minimum":0.05,"maximum":20}}},"color":{"$ref":"https://full-video-pipeline/schemas/animations.schema.json#/definitions/element/properties/color"},"hidden":{"type":"boolean","default":false},"custom":{"type":"object"}}}},"extras":{"type":"object","additionalProperties":false,"properties":{"ringCount":{"type":["integer","null"],"minimum":2,"maximum":30,"default":null},"ringEmitSeconds":{"type":"number","minimum":0.5,"maximum":8,"default":1.6},"ringGapSeconds":{"type":"number","minimum":0,"maximum":4,"default":0.55},"ringEasing":{"$ref":"https://full-video-pipeline/schemas/animations.schema.json#/definitions/easingName"},"ringStrokeWidthPx":{"type":"number","minimum":1,"maximum":32,"default":3},"ringStrokeColor":{"type":["string","null"],"default":null},"ringStartRadiusPx":{"type":"number","minimum":0,"maximum":400,"default":60},"ringMaxRadiusPx":{"type":"number","minimum":100,"maximum":2000,"default":1500},"ringGlow":{"type":"boolean","default":false},"nodeRadiusPx":{"type":"number","minimum":8,"maximum":200,"default":56},"nodeFill":{"type":["string","null"],"default":null},"nodeStroke":{"type":["string","null"],"default":null},"nodeStrokeWidthPx":{"type":"number","minimum":0,"maximum":16,"default":0},"nodeGlow":{"type":"boolean","default":true},"nodeLabelPosition":{"type":"string","enum":["above","below"],"default":"above"},"nodeLabelGapPx":{"type":"number","minimum":0,"maximum":200,"default":24},"scanline":{"type":"boolean","default":false},"scanlineStartSeconds":{"type":"number","minimum":0,"maximum":30,"default":0},"scanlineDurationSeconds":{"type":"number","minimum":0.4,"maximum":30,"default":6},"scanlineColor":{"type":["string","null"],"default":null},"scanlineStrokeWidthPx":{"type":"number","minimum":1,"maximum":10,"default":2},"accentColor":{"type":["string","null"],"default":null},"holdAfterLastEmitFrames":{"type":"integer","minimum":0,"maximum":600,"default":18},"radarDots":{"type":"array","description":"Radar contact dots. Each reveals when the scanline sweep reaches its angle.","items":{"type":"object","additionalProperties":false,"required":["angle","radius","title"],"properties":{"angle":{"type":"number","minimum":-180,"maximum":180,"description":"Degrees clockwise from +x axis (0=right, 90=down, +/-180=left, -90=up). Matches scanline sweep angle."},"radius":{"type":"number","minimum":8,"maximum":2000,"description":"Distance from canvas center in px."},"title":{"type":"string","minLength":1,"maxLength":80},"description":{"type":"string","maxLength":280,"default":""},"color":{"type":["string","null"],"default":null,"description":"Hex override for this dot (defaults to accent)."}}},"default":[]},"ringFadeToCenter":{"type":"boolean","default":true,"description":"Each ring stroke uses a radial gradient fading toward the center."},"scanlineFadeToTip":{"type":"boolean","default":true,"description":"Scanline line uses a linear gradient fading to the outer tip."}}}}}