{"instanceId":"radial-pulse-rings.defaults","theme":{},"global":{"speed":1,"delayOffset":0,"easing":"ease-out-cubic"},"elements":[],"extras":{"ringCount":null,"ringEmitSeconds":3.5,"ringGapSeconds":1.6,"ringEasing":"ease-out-cubic","ringStrokeWidthPx":3,"ringStrokeColor":null,"ringStartRadiusPx":60,"ringMaxRadiusPx":1500,"ringGlow":false,"nodeRadiusPx":56,"nodeFill":null,"nodeStroke":null,"nodeStrokeWidthPx":0,"nodeGlow":true,"nodeLabelPosition":"above","nodeLabelGapPx":24,"scanline":false,"scanlineStartSeconds":0,"scanlineDurationSeconds":6,"scanlineColor":null,"scanlineStrokeWidthPx":2,"accentColor":null,"holdAfterLastEmitFrames":18,"ringFadeToCenter":true,"scanlineFadeToTip":true,"radarDots":[]}}